{
  "schema_version": 1,
  "contract_id": "tracedecay.memory.provider.terminal.v1",
  "bead_id": "tdmem-0206",
  "title": "Memory provider typed terminal, degradation, retry, fallback, cancellation, timeout, and committed-effect contract",
  "status": "accepted",
  "authority": "TraceDecay provider protocol terminal envelope",
  "scope": "coding_agents_only",
  "depends_on_contracts": [
    "tracedecay.memory.provider.registry.v1",
    "tracedecay.memory.provider.handshake.v1",
    "tracedecay.memory.provider.observation.v1",
    "tracedecay.memory.provider.recall.v1",
    "tracedecay.memory.provider.lifecycle.v1"
  ],
  "terminal_envelope": {
    "type_name": "MemoryProviderTerminalEnvelopeV1",
    "contract_id": "tracedecay.memory.provider.terminal-envelope.v1",
    "required_fields": [
      "operation_kind",
      "operation_id",
      "request_identity",
      "provider_id",
      "provider_instance_id",
      "registration_revision",
      "ready_receipt_digest",
      "exact_scope_digest",
      "started_at",
      "finished_at",
      "terminal_code",
      "domain_detail",
      "result_contract_id",
      "result_payload",
      "result_sha256",
      "coverage",
      "retry",
      "fallback",
      "committed_effect",
      "diagnostic_id",
      "warnings"
    ],
    "operation_kinds": [
      "handshake",
      "health",
      "observe",
      "recall",
      "feedback",
      "maintenance",
      "inspection",
      "correction",
      "deletion_by_source",
      "snapshot_export",
      "snapshot_restore",
      "replay",
      "explicit_fact_projection",
      "explain_trace"
    ],
    "unknown_field_policy": "reject_contract_violation",
    "maximum_warnings": 32,
    "diagnostic_id_required_for_failure": true,
    "provider_may_omit_terminal_envelope": false,
    "empty_response_allowed": false
  },
  "terminal_codes": [
    {
      "code": "success",
      "class": "success",
      "effect_expectation": "operation_specific",
      "retry_class": "never",
      "fallback_eligibility": "forbidden"
    },
    {
      "code": "success_zero_results",
      "class": "success",
      "effect_expectation": "none",
      "retry_class": "never",
      "fallback_eligibility": "forbidden"
    },
    {
      "code": "partial",
      "class": "degraded_success",
      "effect_expectation": "none_or_operation_specific",
      "retry_class": "resume_or_new_request",
      "fallback_eligibility": "forbidden"
    },
    {
      "code": "invalid_request",
      "class": "caller_failure",
      "effect_expectation": "none",
      "retry_class": "after_request_change",
      "fallback_eligibility": "forbidden"
    },
    {
      "code": "unauthorized",
      "class": "policy_failure",
      "effect_expectation": "none",
      "retry_class": "after_authorization_change",
      "fallback_eligibility": "forbidden"
    },
    {
      "code": "capability_unsupported",
      "class": "compatibility_failure",
      "effect_expectation": "none",
      "retry_class": "after_provider_or_configuration_change",
      "fallback_eligibility": "explicit_policy_only"
    },
    {
      "code": "scope_unavailable",
      "class": "identity_failure",
      "effect_expectation": "none",
      "retry_class": "after_scope_admission",
      "fallback_eligibility": "forbidden"
    },
    {
      "code": "scope_mismatch",
      "class": "identity_failure",
      "effect_expectation": "none",
      "retry_class": "after_request_change",
      "fallback_eligibility": "forbidden"
    },
    {
      "code": "stale_identity",
      "class": "identity_failure",
      "effect_expectation": "none",
      "retry_class": "after_identity_refresh",
      "fallback_eligibility": "forbidden"
    },
    {
      "code": "conflict",
      "class": "state_failure",
      "effect_expectation": "none",
      "retry_class": "after_state_refresh_or_request_change",
      "fallback_eligibility": "forbidden"
    },
    {
      "code": "capacity_exceeded",
      "class": "resource_failure",
      "effect_expectation": "none",
      "retry_class": "after_backoff_or_capacity_change",
      "fallback_eligibility": "forbidden"
    },
    {
      "code": "deadline_exceeded",
      "class": "request_control_failure",
      "effect_expectation": "none_partial_or_unknown",
      "retry_class": "new_request_only_after_effect_reconciliation",
      "fallback_eligibility": "forbidden"
    },
    {
      "code": "cancelled",
      "class": "request_control_failure",
      "effect_expectation": "none_partial_or_unknown",
      "retry_class": "new_request_only_after_effect_reconciliation",
      "fallback_eligibility": "forbidden"
    },
    {
      "code": "provider_unavailable",
      "class": "availability_failure",
      "effect_expectation": "none_or_unknown",
      "retry_class": "after_bounded_backoff_and_health",
      "fallback_eligibility": "explicit_policy_only"
    },
    {
      "code": "reset_required",
      "class": "operator_failure",
      "effect_expectation": "none",
      "retry_class": "after_operator_reset_or_migration",
      "fallback_eligibility": "forbidden"
    },
    {
      "code": "state_incompatible",
      "class": "compatibility_failure",
      "effect_expectation": "none",
      "retry_class": "after_migration_or_compatible_state",
      "fallback_eligibility": "forbidden"
    },
    {
      "code": "partial_effect",
      "class": "effect_failure",
      "effect_expectation": "partial",
      "retry_class": "resume_or_reconcile_before_retry",
      "fallback_eligibility": "forbidden"
    },
    {
      "code": "effect_unknown",
      "class": "effect_failure",
      "effect_expectation": "unknown",
      "retry_class": "reconcile_before_any_retry",
      "fallback_eligibility": "forbidden"
    },
    {
      "code": "contract_violation",
      "class": "protocol_failure",
      "effect_expectation": "none_partial_or_unknown",
      "retry_class": "after_implementation_fix_and_effect_reconciliation",
      "fallback_eligibility": "forbidden"
    },
    {
      "code": "internal_failure",
      "class": "provider_failure",
      "effect_expectation": "none_partial_or_unknown",
      "retry_class": "after_bounded_backoff_or_fix_and_effect_reconciliation",
      "fallback_eligibility": "forbidden"
    }
  ],
  "domain_detail": {
    "type_name": "MemoryProviderDomainDetailV1",
    "required_fields": [
      "detail_id",
      "detail_version",
      "canonical_payload",
      "payload_sha256"
    ],
    "detail_id_pattern": "^[a-z][a-z0-9]*(?:[._-][a-z0-9]+)*$",
    "detail_version_minimum": 1,
    "maximum_payload_bytes": 131072,
    "detail_may_change_terminal_semantics": false,
    "detail_may_change_retry_or_fallback": false,
    "unknown_optional_detail_policy": "preserve_opaque_inert_round_trip",
    "unknown_required_detail_policy": "reject_contract_violation"
  },
  "result_payload": {
    "type_name": "MemoryProviderResultPayloadV1",
    "success_requires_result_contract_unless_operation_defines_empty_success": true,
    "failure_result_payload_allowed": false,
    "result_contract_id_required_when_payload_present": true,
    "result_sha256_required_when_payload_present": true,
    "canonical_encoding": "rfc8785_json",
    "maximum_payload_bytes_source": "effective_limit.response_bytes",
    "unknown_result_contract_policy": "reject_contract_violation"
  },
  "coverage": {
    "type_name": "MemoryProviderTerminalCoverageV1",
    "required_fields": [
      "state",
      "completed_units",
      "total_units",
      "excluded_units",
      "truncated_units",
      "resume_cursor",
      "reasons"
    ],
    "states": [
      "not_applicable",
      "complete",
      "partial",
      "zero_results"
    ],
    "partial_requires_reason": true,
    "success_zero_results_requires_zero_results_coverage": true,
    "partial_terminal_requires_partial_coverage": true,
    "failure_cannot_claim_complete_coverage": true,
    "resume_cursor_is_scope_request_and_state_bound": true
  },
  "retry": {
    "type_name": "MemoryProviderRetryDirectiveV1",
    "required_fields": [
      "class",
      "automatic_retry_allowed",
      "minimum_backoff_millis",
      "maximum_attempts_remaining",
      "requires_identity_refresh",
      "requires_state_reconciliation",
      "requires_operator_action",
      "resume_cursor"
    ],
    "classes": [
      "never",
      "after_request_change",
      "after_authorization_change",
      "after_provider_or_configuration_change",
      "after_scope_admission",
      "after_identity_refresh",
      "after_state_refresh_or_request_change",
      "after_backoff_or_capacity_change",
      "new_request_only_after_effect_reconciliation",
      "after_bounded_backoff_and_health",
      "after_operator_reset_or_migration",
      "after_migration_or_compatible_state",
      "resume_or_new_request",
      "resume_or_reconcile_before_retry",
      "reconcile_before_any_retry",
      "after_implementation_fix_and_effect_reconciliation",
      "after_bounded_backoff_or_fix_and_effect_reconciliation"
    ],
    "automatic_retry_default": false,
    "automatic_retry_requires_explicit_policy_and_positive_budget": true,
    "minimum_backoff_millis_minimum": 0,
    "maximum_attempts_remaining_minimum": 0,
    "unbounded_attempts_allowed": false,
    "retry_may_reuse_new_idempotency_key_for_same_mutation": false,
    "retry_may_begin_before_unknown_or_partial_effect_reconciliation": false
  },
  "fallback": {
    "type_name": "MemoryProviderFallbackDirectiveV1",
    "required_fields": [
      "eligibility",
      "policy_id",
      "policy_revision",
      "target_provider_id",
      "reason"
    ],
    "eligibility_values": [
      "forbidden",
      "explicit_policy_only"
    ],
    "default_eligibility": "forbidden",
    "fallback_may_be_inferred_from_empty_result": false,
    "fallback_may_be_inferred_from_provider_unavailable": false,
    "fallback_requires_pinned_policy": true,